{
  "contract_id": "demo-software-engineering-001",
  "version": "0.1.0",
  "objective": "Refactor this backend while preserving public behavior.",
  "domain": "software-engineering",
  "task_type": "behavior-preserving-refactor",
  "required_agents": [
    {
      "agent_id": "refactor_planner",
      "role_spec": "Identify behavior boundaries, affected modules, risks, and required checks before edits.",
      "execution_spec": "Read source and tests, produce a scoped refactor plan, and block if public behavior is unclear.",
      "output_spec": "Refactor plan with behavior inventory, file scope, risk notes, and required verification commands."
    },
    {
      "agent_id": "verification_reviewer",
      "role_spec": "Verify that behavior is preserved and that claimed success is supported by test evidence.",
      "execution_spec": "Run tests and inspect the diff before release. Block or fail on missing evidence.",
      "output_spec": "Verification report with test commands, results, diff summary, and remaining risks."
    }
  ],
  "required_tools": [
    "source_reader",
    "test_runner",
    "diff_inspector"
  ],
  "required_evidence": [
    "public_behavior_inventory",
    "refactor_plan",
    "test_results",
    "diff_summary"
  ],
  "gates": [
    {
      "gate_id": "scope_gate",
      "condition": "Public behavior boundaries and affected files are listed before edits.",
      "on_failure": "blocked_missing_scope"
    },
    {
      "gate_id": "test_gate",
      "condition": "Relevant tests or equivalent checks pass after refactor.",
      "on_failure": "failed_verification"
    },
    {
      "gate_id": "artifact_gate",
      "condition": "Patch summary and verification report exist before success is claimed.",
      "on_failure": "blocked_missing_artifact"
    }
  ],
  "expected_artifacts": [
    "refactor_plan",
    "governed_patch",
    "verification_report"
  ],
  "failure_semantics": {
    "on_missing_evidence": "blocked",
    "on_gate_failure": "blocked",
    "on_test_failure": "failed",
    "on_unsupported_capability": "unsupported"
  },
  "execution_constraints": {
    "no_fake_success": true,
    "no_silent_fallback": true,
    "no_hardcoded_fallback": true,
    "preserve_public_behavior": true
  },
  "human_approval": {
    "required": false,
    "before": []
  },
  "unsupported_features": []
}
